ID,name,description,url,created,last modified,version,tactics,detection,platforms,data sources,is sub-technique,sub-technique of,defenses bypassed,contributors,permissions required,supports remote,system requirements,impact type,effective permissions,relationship citations,entities,mitigations
T1071.001,Application Layer Protocol: Web Protocols,"Adversaries may communicate using application layer protocols associated with web traffic to avoid detection/network filtering by blending in with existing traffic. Commands to the remote system, and often the results of those commands, will be embedded within the protocol traffic between the client and server. 

Protocols such as HTTP/S(Citation: CrowdStrike Putter Panda) and WebSocket(Citation: Brazking-Websockets) that carry web traffic may be very common in environments. HTTP/S packets have many fields and headers in which data can be concealed. An adversary may abuse these protocols to communicate with systems under their control within a victim network while also mimicking normal, expected traffic. ",https://attack.mitre.org/techniques/T1071/001,15 March 2020,11 April 2023,1.1,['Command and Control'],"Analyze network data for uncommon data flows (e.g., a client sending significantly more data than it receives from a server). Processes utilizing the network that do not normally have network communication or have never been seen before are suspicious. Analyze packet contents to detect application layer protocols that do not follow the expected protocol standards regarding syntax, structure, or any other variable adversaries could leverage to conceal data.(Citation: University of Birmingham C2)

Monitor for web traffic to/from known-bad or suspicious domains. ","['Linux', 'Windows', 'macOS']","Network Traffic: Network Traffic Content, Network Traffic: Network Traffic Flow",True,T1071,,TruKno,,,,,,"(Citation: Cybereason Kimsuky November 2020),(Citation: Talos Kimsuky Nov 2021),(Citation: Intezer TeamTNT September 2020),(Citation: CISA ComRAT Oct 2020),(Citation: ESET Nomadic Octopus 2018),(Citation: Kaspersky Turla),(Citation: PWC WellMess C2 August 2020),(Citation: PTSecurity Cobalt Dec 2016),(Citation: Unit 42 NOKKI Sept 2018),(Citation: Checkpoint Dridex Jan 2021),(Citation: Palo Alto menuPass Feb 2017),(Citation: Radware Micropsia July 2018),(Citation: Talos Cobalt Strike September 2020),(Citation: Unit 42 BackConfig May 2020),(Citation: Fidelis INOCNATION),(Citation: FireEye Hacking FIN4 Video Dec 2014),(Citation: FireEye Fin8 May 2016),(Citation: MacKeeper Bundlore Apr 2019),(Citation: RATANKBA),(Citation: Lazarus APT January 2022),(Citation: synack 2016 review),(Citation: Security Intelligence More Eggs Aug 2019),(Citation: Recorded Future REDDELTA July 2020),(Citation: MalwareBytes WoodyRAT Aug 2022),(Citation: Unit 42 Valak July 2020),(Citation: objsee mac malware 2017),(Citation: Proofpoint Operation Transparent Tribe March 2016),(Citation: FireEye APT28),(Citation: Unit42 Xbash Sept 2018),(Citation: FireEye SMOKEDHAM June 2021),(Citation: Anomali Pirate Panda April 2020),(Citation: Mandiant APT1 Appendix),(Citation: Trend Micro Black Basta October 2022),(Citation: Kaspersky Regin),(Citation: McAfee Sharpshooter December 2018),(Citation: Mythc Documentation),(Citation: Unit42 Redaman January 2019),(Citation: ESET Grandoreiro April 2020),(Citation: Forcepoint Felismus Mar 2017),(Citation: Citizen Lab Stealth Falcon May 2016),(Citation: Kaspersky Dridex May 2017),(Citation: Kaspersky QakBot September 2021),(Citation: reed thiefquest ransomware analysis),(Citation: Palo Alto Comnie),(Citation: Securelist APT10 March 2021),(Citation: Symantec Dyre June 2015),(Citation: Malwarebytes SmokeLoader 2016),(Citation: NCC Group APT15 Alive and Strong),(Citation: ThreatStream Evasion Analysis),(Citation: ClearSky Lazarus Aug 2020),(Citation: Secureworks BRONZE PRESIDENT December 2019),(Citation: TrendMicro Taidoor),(Citation: PaloAlto UBoatRAT Nov 2017),(Citation: Kaspersky LuminousMoth July 2021),(Citation: Microsoft HAFNIUM March 2020),(Citation: ESET Turla Mosquito Jan 2018),(Citation: CheckPoint Volatile Cedar March 2015),(Citation: FireEye HAWKBALL Jun 2019),(Citation: ESET Zebrocy Nov 2018),(Citation: DFIR Conti Bazar Nov 2021),(Citation: Trend Micro IXESHE 2012),(Citation: CheckPoint SpeakUp Feb 2019),(Citation: Lab52 WIRTE Apr 2019),(Citation: FireEye Ursnif Nov 2017),(Citation: FireEye FiveHands April 2021),(Citation: Group IB GrimAgent July 2021),(Citation: DigiTrust Agent Tesla Jan 2017),(Citation: Palo Alto Shamoon Nov 2016),(Citation: Profero APT27 December 2020),(Citation: Palo Alto Brute Ratel July 2022),(Citation: JPCert PLEAD Downloader June 2018),(Citation: wardle evilquest partii),(Citation: Talos ZxShell Oct 2014),(Citation: Trend Micro Iron Tiger April 2021),(Citation: Medium Eli Salem GuLoader April 2021),(Citation: Cybereason Chaes Nov 2020),(Citation: F-Secure The Dukes),(Citation: Dell Sakula),(Citation: TrendMicro Ursnif Mar 2015),(Citation: Cisco Talos Bitter Bangladesh May 2022),(Citation: Cybersecurity Advisory GRU Brute Force Campaign July 2021),(Citation: Secureworks REvil September 2019),(Citation: Mandiant UNC3890 Aug 2022),(Citation: PaloAlto CardinalRat Apr 2017),(Citation: Securelist LuckyMouse June 2018),(Citation: SentinelLabs Metador Sept 2022),(Citation: Rancor Unit42 June 2018),(Citation: Lookout Dark Caracal Jan 2018),(Citation: Unit 42 VERMIN Jan 2018),(Citation: GitHub PoshC2),(Citation: FireEye admin@338),(Citation: Palo Alto Gamaredon Feb 2017),(Citation: ESET BackdoorDiplomacy Jun 2021),(Citation: Trend Micro Tick November 2019),(Citation: McAfee Sodinokibi October 2019),(Citation: Trend Micro DRBControl February 2020),(Citation: Trend Micro Muddy Water March 2021),(Citation: FireEye APT10 Sept 2018),(Citation: McAfee Lazarus Nov 2020),(Citation: TrendMicro macOS Dacls May 2020),(Citation: Cybereason OperationCuckooBees May 2022),(Citation: cobaltstrike manual),(Citation: Proofpoint NETWIRE December 2020),(Citation: CrowdStrike StellarParticle January 2022),(Citation: S2 Grupo TrickBot June 2017),(Citation: Trend Micro MacOS Backdoor November 2020),(Citation: Scarlet Mimic Jan 2016),(Citation: F-Secure Cosmicduke),(Citation: Malwarebytes Pony April 2016),(Citation: Talos ROKRAT),(Citation: Malwarebytes Higaisa 2020),(Citation: McAfee GhostSecret),(Citation: 360 Machete Sep 2020),(Citation: FireEye APT38 Oct 2018),(Citation: ESET Casbaneiro Oct 2019),(Citation: Cylance Machete Mar 2017),(Citation: Cisco Talos Intelligence Group),(Citation: Unit 42 PingPull Jun 2022),(Citation: Baumgartner Naikon 2015),(Citation: F-Secure CozyDuke),(Citation: Dell TG-3390),(Citation: Cobalt Strike Manual 4.3 November 2020),(Citation: Cado Security TeamTNT Worm August 2020),(Citation: Trend Micro TeamTNT),(Citation: Unit 42 QUADAGENT July 2018),(Citation: SentinelLabs Metador Technical Appendix Sept 2022),(Citation: Unit 42 BadPatch Oct 2017),(Citation: Lotus Blossom Dec 2015),(Citation: FoxIT Wocao December 2019),(Citation: Kaspersky Carbanak),(Citation: Unit 42 RGDoor Jan 2018),(Citation: NCCGroup RokRat Nov 2018),(Citation: NSA/FBI Drovorub August 2020),(Citation: JPCERT ChChes Feb 2017),(Citation: Malwarebytes Saint Bot April 2021),(Citation: TrendMicro BlackTech June 2017),(Citation: MSTIC Nobelium Toolset May 2021),(Citation: Intezer Doki July 20),(Citation: ESET GreyEnergy Oct 2018),(Citation: FireEye APT34 Webinar Dec 2017),(Citation: Sofacy DealersChoice),(Citation: Proofpoint TA505 Jan 2019),(Citation: Talos PoetRAT October 2020),(Citation: Accenture HyperStack October 2020),(Citation: CrowdStrike Grim Spider May 2019),(Citation: FireEye Know Your Enemy FIN8 Aug 2016),(Citation: Bitdefender StrongPity June 2020),(Citation: Secureworks MCMD July 2019),(Citation: Intrinsec Egregor Nov 2020),(Citation: NTT Security Flagpro new December 2021),(Citation: Secureworks BRONZE BUTLER Oct 2017),(Citation: ESET InvisiMole June 2018),(Citation: JPCert TSCookie March 2018),(Citation: Proofpoint LookBack Malware Aug 2019),(Citation: CrowdStrike Putter Panda),(Citation: Prevailion DarkWatchman 2021),(Citation: FireEye HIKIT Rootkit Part 2),(Citation: Kaspersky Ferocious Kitten Jun 2021),(Citation: Unit 42 OilRig Sept 2018),(Citation: Palo Alto OilRig May 2016),(Citation: Palo Alto Reaver Nov 2017),(Citation: Talos Frankenstein June 2019),(Citation: NCSC Cyclops Blink February 2022),(Citation: FireEye SUNSHUTTLE Mar 2021),(Citation: PaloAlto DNS Requests May 2016),(Citation: Group IB Cobalt Aug 2017),(Citation: Anomali MUSTANG PANDA October 2019),(Citation: Cyphort EvilBunny Dec 2014),(Citation: Talos Promethium June 2020),(Citation: objective-see windtail2 jan 2019),(Citation: JPCert BlackTech Malware September 2019),(Citation: ClearSky Charming Kitten Dec 2017),(Citation: Symantec Orangeworm IOCs April 2018),(Citation: Juniper IcedID June 2020),(Citation: Costa AvosLocker May 2022),(Citation: F-Secure BlackEnergy 2014),(Citation: Cybersecurity Advisory SVR TTP May 2021),(Citation: Kaspersky Lyceum October 2021),(Citation: Unit42 RDAT July 2020),(Citation: ESET Sednit Part 1),(Citation: Kaspersky ProjectSauron Full Report),(Citation: Checkpoint IndigoZebra July 2021),(Citation: Mandiant APT41),(Citation: McAfee Lazarus Resurfaces Feb 2018),(Citation: Kaspersky Cloud Atlas December 2014),(Citation: Github PowerShell Empire),(Citation: Trend Micro Cyclops Blink March 2022),(Citation: CISA SoreFang July 2016),(Citation: Talos Micropsia June 2017),(Citation: ESET Turla Mosquito May 2018),(Citation: MSTIC FoggyWeb September 2021),(Citation: Fortinet Agent Tesla June 2017),(Citation: Symantec Remsec IOCs),(Citation: FireEye FELIXROOT July 2018),(Citation: Kaspersky WIRTE November 2021),(Citation: FireEye Hacking FIN4 Dec 2014),(Citation: Unit 42 Magic Hound Feb 2017),(Citation: KISA Operation Muzabi),(Citation: Zscaler Higaisa 2020),(Citation: DFIR Phosphorus November 2021),(Citation: MalwareBytes SideCopy Dec 2021),(Citation: NCC Group Chimera January 2021),(Citation: Malwarebytes RokRAT VBA January 2021),(Citation: Antiy CERT Ramsay April 2020),(Citation: Unit 42 NETWIRE April 2020),(Citation: McAfee Bankshot),(Citation: McAfee Night Dragon),(Citation: BlackBerry Bahamut),(Citation: ProofPoint Ursnif Aug 2016),(Citation: Talos TinyTurla September 2021),(Citation: Secureworks GandCrab and REvil September 2019),(Citation: Unit42 SUPERNOVA Dec 2020),(Citation: US-CERT BLINDINGCAN Aug 2020),(Citation: Rewterz Sidewinder COVID-19 June 2020),(Citation: Infoblox Lokibot January 2019),(Citation: Unit42 Molerat Mar 2020),(Citation: CERT-EE Gamaredon January 2021),(Citation: NorthSec 2015 GData Uroburos Tools),(Citation: Bishop Fox Sliver Framework August 2019),(Citation: FOX-IT May 2016 Mofang),(Citation: ESET TeleBots Oct 2018),(Citation: Cybereason Bazar July 2020),(Citation: Palo Alto Sofacy 06-2018),(Citation: ESET Crutch December 2020),(Citation: Talos Konni May 2017),(Citation: Volexity InkySquid BLUELIGHT August 2021),(Citation: Unit42 Emissary Panda May 2019),(Citation: Unit 42 MechaFlounder March 2019),(Citation: FireEye APT30),(Citation: Unit 42 Nokki Oct 2018),(Citation: TrendMicro TropicTrooper 2015),(Citation: CYBERCOM Iranian Intel Cyber January 2022),(Citation: Microsoft GALLIUM December 2019),(Citation: CrowdStrike IceApple May 2022),(Citation: Unit42 Cannon Nov 2018),(Citation: ESET Gelsemium June 2021),(Citation: Unit 42 Gamaredon February 2022),(Citation: TrendMicro Tropic Trooper May 2020),(Citation: TrendMicro Gamaredon April 2020),(Citation: Proofpoint TA416 Europe March 2022),(Citation: Unit 42 C0d0so0 Jan 2016),(Citation: ClearSky Siamesekitten August 2021),(Citation: Securelist Remexi Jan 2019),(Citation: Microsoft Actinium February 2022),(Citation: Unit 42 Playbook Dec 2017),(Citation: Microsoft POLONIUM June 2022),(Citation: McAfee Lazarus Jul 2020),(Citation: Symantec Elfin Mar 2019),(Citation: Malwarebytes Kimsuky June 2021),(Citation: ObjectiveSee AppleJeus 2019),(Citation: Trusteer Carberp October 2010),(Citation: Cyberreason Anchor December 2019),(Citation: FireEye EPS Awakens Part 2),(Citation: Talos GravityRAT),(Citation: McAfee Dianxun March 2021),(Citation: Red Canary NETWIRE January 2020),(Citation: Unit42 SilverTerrier 2018),(Citation: Unit42 OilRig Playbook 2023),(Citation: ESET Twitter Ida Pro Nov 2021),(Citation: ClearSky MuddyWater June 2019),(Citation: Palo Alto Unit 42 OutSteel SaintBot February 2022 ),(Citation: Trend Micro njRAT 2018),(Citation: SentinelOne Lazarus macOS July 2020),(Citation: NCSC APT29 July 2020),(Citation: Malwarebytes DarkComet March 2018),(Citation: Unit42 Sofacy Dec 2018),(Citation: DFIR Report APT35 ProxyShell March 2022),(Citation: Palo Alto Networks BBSRAT),(Citation: Proofpoint TA505 Mar 2018),(Citation: CISA AppleJeus Feb 2021),(Citation: Kaspersky Turla Aug 2014),(Citation: Kaspersky ProjectSauron Technical Analysis),(Citation: Microsoft PLATINUM April 2016),(Citation: Check Point APT34 April 2021),(Citation: Microsoft NICKEL December 2021),(Citation: MalwareBytes LazyScripter Feb 2021),(Citation: Trend Micro Qakbot May 2020),(Citation: ZScaler Squirrelwaffle Sep 2021),(Citation: SentinelOne Aoqin Dragon June 2022),(Citation: ESET Zebrocy May 2019),(Citation: Securelist Octopus Oct 2018),(Citation: GitHub Sliver C2),(Citation: Talos Group123),(Citation: Talos Lokibot Jan 2021),(Citation: ESET Machete July 2019),(Citation: McAfee Gold Dragon),(Citation: Accenture Lyceum Targets November 2021),(Citation: ESET Gamaredon June 2020),(Citation: Donut Github),(Citation: Cylance Dust Storm),(Citation: Kaspersky ShadowPad Aug 2017),(Citation: Volexity SolarWinds),(Citation: IBM Grandoreiro April 2020),(Citation: FireEye APT41 March 2020),(Citation: FireEye APT29 Nov 2018),(Citation: DustySky),(Citation: Accenture Hogfish April 2018),(Citation: Bitdefender FIN8 July 2021),(Citation: Lotus Blossom Jun 2015),(Citation: Microsoft SIR Vol 19),(Citation: Unit 42 Sofacy Feb 2018),(Citation: Lazarus RATANKBA),(Citation: ESET Dukes October 2019),(Citation: FireEye APT19),(Citation: ANSSI Sandworm January 2021),(Citation: Cybereason Cobalt Kitty 2017),(Citation: Accenture SNAKEMACKEREL Nov 2018),(Citation: Symantec Vasport May 2012),(Citation: Malwarebytes Konni Aug 2021),(Citation: Talos Cobalt Group July 2018),(Citation: Kaspersky CactusPete Aug 2020),(Citation: Proofpoint ZeroT Feb 2017),(Citation: BlackBerry Amadey 2020),(Citation: FireEye APT10 April 2017),(Citation: Nicolas Falliere, Liam O Murchu, Eric Chien February 2011),(Citation: Volexity OceanLotus Nov 2017),(Citation: FBI FLASH APT39 September 2020),(Citation: Kaspersky Sofacy),(Citation: CISA WellMess July 2020),(Citation: Anomali Rocke March 2019),(Citation: Bitdefender Naikon April 2021),(Citation: FireEye APT34 July 2019),(Citation: Unit 42 WhisperGate January 2022),(Citation: ESET Okrum July 2019),(Citation: DHS CISA AA22-055A MuddyWater February 2022),(Citation: Secureworks Karagany July 2019),(Citation: HP SVCReady Jun 2022),(Citation: Kaspersky Cloud Atlas August 2019),(Citation: Trustwave GoldenSpy June 2020),(Citation: Proofpoint TA505 October 2019),(Citation: Talos Zeus Panda Nov 2017),(Citation: Chronicle Winnti for Linux May 2019),(Citation: Cybereason Valak May 2020),(Citation: Novetta Winnti April 2015),(Citation: Aqua Kinsing April 2020),(Citation: ATT Sidewinder January 2021),(Citation: FireEye APT34 Dec 2017),(Citation: FireEye APT29),(Citation: Kaspersky Tomiris Sep 2021),(Citation: Secureworks DarkTortilla Aug 2022),(Citation: Bitdefender FunnyDream Campaign November 2020),(Citation: ESET ComRAT May 2020),(Citation: Uptycs Confucius APT Jan 2021),(Citation: GitHub Pupy),(Citation: MSTIC NOBELIUM Mar 2021),(Citation: ESET Gazer Aug 2017),(Citation: Check Point APT35 CharmPower January 2022),(Citation: Sofacy Komplex Trojan),(Citation: FireEye APT33 Guardrail),(Citation: ESET Telebots Dec 2016),(Citation: IBM TA505 April 2020),(Citation: Morphisec ShellTea June 2019),(Citation: Symantec Shuckworm January 2022),(Citation: ESET Sednit Part 2),(Citation: Medium Metamorfo Apr 2020),(Citation: Forcepoint BITTER Pakistan Oct 2016),(Citation: CISA MAR SLOTHFULMEDIA October 2020),(Citation: Cylance Sodinokibi July 2019),(Citation: Fortinet Diavol July 2021),(Citation: Proofpoint TA459 April 2017),(Citation: McAfee Maze March 2020),(Citation: Mandiant UNC3313 Feb 2022),(Citation: Unit 42 Bisonal July 2018),(Citation: Unit 42 Kazuar May 2017),(Citation: Unit 42 OopsIE! Feb 2018),(Citation: PWC WellMess July 2020),(Citation: PaloAlto Patchwork Mar 2018),(Citation: NCC Group Team9 June 2020),(Citation: Intel 471 REvil March 2020),(Citation: Unit 42 Inception November 2018),(Citation: FireEye Periscope March 2018),(Citation: Moran 2013),(Citation: FireEye SUNBURST Backdoor December 2020),(Citation: CheckPoint Naikon May 2020),(Citation: Qualys LolZarus),(Citation: Rewterz Sidewinder APT April 2020),(Citation: Medium S2W WhisperGate January 2022),(Citation: SecureWorks August 2019),(Citation: ESET Industroyer),(Citation: Crowdstrike Qakbot October 2020),(Citation: Moran 2014),(Citation: BitDefender Chafer May 2020),(Citation: Guidepoint SUPERNOVA Dec 2020),(Citation: Malwarebytes Dyreza November 2015),","['actor', 'process', 'data flow']","[{'mitigation id': 'M1031', 'mitigation name': 'Network Intrusion Prevention', 'mitigation description': 'Use intrusion detection signatures to block traffic at network boundaries.', 'mitigation url': 'https://attack.mitre.org/mitigations/M1031'}]"
T1071.002,Application Layer Protocol: File Transfer Protocols,"Adversaries may communicate using application layer protocols associated with transferring files to avoid detection/network filtering by blending in with existing traffic. Commands to the remote system, and often the results of those commands, will be embedded within the protocol traffic between the client and server. 

Protocols such as FTP, FTPS, and TFTP that transfer files may be very common in environments.  Packets produced from these protocols may have many fields and headers in which data can be concealed. Data could also be concealed within the transferred files. An adversary may abuse these protocols to communicate with systems under their control within a victim network while also mimicking normal, expected traffic. ",https://attack.mitre.org/techniques/T1071/002,15 March 2020,21 August 2020,1.0,['Command and Control'],"Analyze network data for uncommon data flows (e.g., a client sending significantly more data than it receives from a server). Processes utilizing the network that do not normally have network communication or have never been seen before are suspicious. Analyze packet contents to detect application layer protocols that do not follow the expected protocol for the port that is being used.(Citation: University of Birmingham C2)","['Linux', 'Windows', 'macOS']","Network Traffic: Network Traffic Content, Network Traffic: Network Traffic Flow",True,T1071,,,,,,,,"(Citation: Mythc Documentation),(Citation: XAgentOSX 2017),(Citation: McAfee Honeybee),(Citation: Unit 42 CARROTBAT November 2018),(Citation: Talos ZxShell Oct 2014),(Citation: ESET Machete July 2019),(Citation: Unit 42 Kazuar May 2017),(Citation: ESET Attor Oct 2019),(Citation: 360 Machete Sep 2020),(Citation: FireEye APT41 March 2020),(Citation: VirusBulletin Kimsuky October 2019),(Citation: Talos PoetRAT October 2020),(Citation: Microsoft PLATINUM April 2016),(Citation: Cylance Machete Mar 2017),(Citation: Kaspersky ShadowPad Aug 2017),(Citation: Unit 42 NOKKI Sept 2018),(Citation: Unit42 SilverTerrier 2018),(Citation: Unit 42 CARROTBAT January 2020),","['actor', 'process', 'data flow']","[{'mitigation id': 'M1031', 'mitigation name': 'Network Intrusion Prevention', 'mitigation description': 'Use intrusion detection signatures to block traffic at network boundaries.', 'mitigation url': 'https://attack.mitre.org/mitigations/M1031'}]"
T1071.003,Application Layer Protocol: Mail Protocols,"Adversaries may communicate using application layer protocols associated with electronic mail delivery to avoid detection/network filtering by blending in with existing traffic. Commands to the remote system, and often the results of those commands, will be embedded within the protocol traffic between the client and server. 

Protocols such as SMTP/S, POP3/S, and IMAP that carry electronic mail may be very common in environments.  Packets produced from these protocols may have many fields and headers in which data can be concealed. Data could also be concealed within the email messages themselves. An adversary may abuse these protocols to communicate with systems under their control within a victim network while also mimicking normal, expected traffic. ",https://attack.mitre.org/techniques/T1071/003,15 March 2020,21 October 2020,1.0,['Command and Control'],"Analyze network data for uncommon data flows (e.g., a client sending significantly more data than it receives from a server). Processes utilizing the network that do not normally have network communication or have never been seen before are suspicious. Analyze packet contents to detect application layer protocols that do not follow the expected protocol standards regarding syntax, structure, or any other variable adversaries could leverage to conceal data.(Citation: University of Birmingham C2)","['Linux', 'Windows', 'macOS']","Network Traffic: Network Traffic Content, Network Traffic: Network Traffic Flow",True,T1071,,,,,,,,"(Citation: Palo Alto Sofacy 06-2018),(Citation: Fortinet Agent Tesla June 2017),(Citation: Crowdstrike GTR2020 Mar 2020),(Citation: Microsoft SIR Vol 19),(Citation: DigiTrust Agent Tesla Jan 2017),(Citation: CISA AA20-301A Kimsuky),(Citation: Unit 42 BadPatch Oct 2017),(Citation: Kaspersky ProjectSauron Technical Analysis),(Citation: Symantec Remsec IOCs),(Citation: Microsoft PLATINUM April 2016),(Citation: ESET Sednit Part 2),(Citation: Unit42 Cannon Nov 2018),(Citation: FireEye APT28),(Citation: Cybereason Cobalt Kitty 2017),(Citation: Accenture SNAKEMACKEREL Nov 2018),(Citation: Cybereason Oceanlotus May 2017),(Citation: ESET LightNeuron May 2019),(Citation: ESET Zebrocy May 2019),(Citation: Unit42 SilverTerrier 2018),(Citation: Unit42 RDAT July 2020),(Citation: Mandiant UNC3890 Aug 2022),(Citation: Cybersecurity Advisory GRU Brute Force Campaign July 2021),(Citation: Talos NavRAT May 2018),(Citation: Kaspersky ProjectSauron Full Report),(Citation: ESET Zebrocy Nov 2018),(Citation: Bitdefender Agent Tesla April 2020),(Citation: Unit42 Sofacy Dec 2018),(Citation: ESET ComRAT May 2020),","['actor', 'process', 'data flow']","[{'mitigation id': 'M1031', 'mitigation name': 'Network Intrusion Prevention', 'mitigation description': 'Use intrusion detection signatures to block traffic at network boundaries.', 'mitigation url': 'https://attack.mitre.org/mitigations/M1031'}]"
