ID,name,description,url,created,last modified,version,tactics,detection,platforms,data sources,is sub-technique,sub-technique of,defenses bypassed,contributors,permissions required,supports remote,system requirements,impact type,effective permissions,relationship citations,entities,mitigations
T1555.003,Credentials from Password Stores: Credentials from Web Browsers,"Adversaries may acquire credentials from web browsers by reading files specific to the target browser.(Citation: Talos Olympic Destroyer 2018) Web browsers commonly save credentials such as website usernames and passwords so that they do not need to be entered manually in the future. Web browsers typically store the credentials in an encrypted format within a credential store; however, methods exist to extract plaintext credentials from web browsers.

For example, on Windows systems, encrypted credentials may be obtained from Google Chrome by reading a database file, <code>AppData\Local\Google\Chrome\User Data\Default\Login Data</code> and executing a SQL query: <code>SELECT action_url, username_value, password_value FROM logins;</code>. The plaintext password can then be obtained by passing the encrypted credentials to the Windows API function <code>CryptUnprotectData</code>, which uses the victim’s cached logon credentials as the decryption key.(Citation: Microsoft CryptUnprotectData April 2018)
 
Adversaries have executed similar procedures for common web browsers such as FireFox, Safari, Edge, etc.(Citation: Proofpoint Vega Credential Stealer May 2018)(Citation: FireEye HawkEye Malware July 2017) Windows stores Internet Explorer and Microsoft Edge credentials in Credential Lockers managed by the [Windows Credential Manager](https://attack.mitre.org/techniques/T1555/004).

Adversaries may also acquire credentials by searching web browser process memory for patterns that commonly match credentials.(Citation: GitHub Mimikittenz July 2016)

After acquiring credentials from web browsers, adversaries may attempt to recycle the credentials across different systems and/or accounts in order to expand access. This can result in significantly furthering an adversary's objective in cases where credentials gained from web browsers overlap with privileged accounts (e.g. domain administrator).",https://attack.mitre.org/techniques/T1555/003,12 February 2020,15 February 2022,1.1,['Credential Access'],"Identify web browser files that contain credentials such as Google Chrome’s Login Data database file: <code>AppData\Local\Google\Chrome\User Data\Default\Login Data</code>. Monitor file read events of web browser files that contain credentials, especially when the reading process is unrelated to the subject web browser. Monitor process execution logs to include PowerShell Transcription focusing on those that perform a combination of behaviors including reading web browser process memory, utilizing regular expressions, and those that contain numerous keywords for common web applications (Gmail, Twitter, Office365, etc.).","['Linux', 'Windows', 'macOS']","Command: Command Execution, File: File Access, Process: OS API Execution, Process: Process Access",True,T1555,,"Barry Shteiman, Exabeam; RedHuntLabs, @redhuntlabs; Ryan Benson, Exabeam; Sylvain Gil, Exabeam",['User'],,,,,"(Citation: Cybereason Kimsuky November 2020),(Citation: GitHub QuasarRAT),(Citation: Talos Kimsuky Nov 2021),(Citation: IBM IcedID November 2017),(Citation: Kaspersky Adwind Feb 2016),(Citation: Trend Micro Muddy Water March 2021),(Citation: Proofpoint NETWIRE December 2020),(Citation: Citizen Lab Group5),(Citation: CrowdStrike StellarParticle January 2022),(Citation: Trend Micro Emotet Jan 2019),(Citation: Talos Olympic Destroyer 2018),(Citation: Visa FIN6 Feb 2019),(Citation: Check Point Rocket Kitten),(Citation: MSTIC DEV-0537 Mar 2022),(Citation: Infoblox Lokibot January 2019),(Citation: Bitdefender Agent Tesla April 2020),(Citation: BiZone Lizar May 2021),(Citation: Talos Smoke Loader July 2018),(Citation: Bitdefender Trickbot VNC module Whitepaper 2021),(Citation: GitHub LaZagne Dec 2018),(Citation: Uptycs Warzone UAC Bypass November 2020),(Citation: ESET PLEAD Malware July 2018),(Citation: Bitdefender Naikon April 2021),(Citation: Talos Konni May 2017),(Citation: GitHub SILENTTRINITY Modules July 2019),(Citation: Volexity InkySquid BLUELIGHT August 2021),(Citation: FireEye APT34 July 2019),(Citation: Talos PoetRAT April 2020),(Citation: objsee mac malware 2017),(Citation: Proofpoint Operation Transparent Tribe March 2016),(Citation: Secureworks Karagany July 2019),(Citation: FireEye APT37 Feb 2018),(Citation: FireEye APT28),(Citation: Prevx Carberp March 2011),(Citation: Unit42 CookieMiner Jan 2019),(Citation: Zscaler APT31 Covid-19 October 2020),(Citation: TrendMicro BlackTech June 2017),(Citation: Check Point Warzone Feb 2020),(Citation: Volexity Patchwork June 2018),(Citation: FireEye APT34 Webinar Dec 2017),(Citation: NCSC Joint Report Public Tools),(Citation: ESET Grandoreiro April 2020),(Citation: Cymmetria Patchwork),(Citation: FireEye NETWIRE March 2019),(Citation: Securelist BlackEnergy Nov 2014),(Citation: GitHub Pupy),(Citation: Citizen Lab Stealth Falcon May 2016),(Citation: Kaspersky QakBot September 2021),(Citation: FireEye APT35 2018),(Citation: Symantec Elfin Mar 2019),(Citation: CISA AA20-301A Kimsuky),(Citation: FireEye APT33 Guardrail),(Citation: Cyberreason Anchor December 2019),(Citation: ESET Telebots Dec 2016),(Citation: Trend Micro Trickbot Nov 2018),(Citation: Red Canary NETWIRE January 2020),(Citation: PWC Cloud Hopper Technical Annex April 2017),(Citation: Unit42 OilRig Playbook 2023),(Citation: Rapid7 KeyBoy Jun 2013),(Citation: Symantec Dragonfly),(Citation: JPCert TSCookie March 2018),(Citation: Trend Micro njRAT 2018),(Citation: Securelist Brazilian Banking Malware July 2020),(Citation: Proofpoint TA505 Sep 2017),(Citation: Netscout Stolen Pencil Dec 2018),(Citation: GitHub Mimikatz lsadump Module),(Citation: XAgentOSX 2017),(Citation: Unit42 Azorult Nov 2018),(Citation: Symantec Inception Framework March 2018),(Citation: Symantec Buckeye),(Citation: Forcepoint Monsoon),(Citation: Zdnet Kimsuky Dec 2018),(Citation: Symantec MuddyWater Dec 2018),(Citation: QiAnXin APT-C-36 Feb2019),(Citation: Fidelis njRAT June 2013),(Citation: Cybereason Chaes Nov 2020),(Citation: ESET Zebrocy May 2019),(Citation: F-Secure The Dukes),(Citation: F-Secure BlackEnergy 2014),(Citation: ESET Machete July 2019),(Citation: Talos Group123),(Citation: ESET Operation Groundbait),(Citation: Kaspersky Lyceum October 2021),(Citation: Mandiant UNC3890 Aug 2022),(Citation: Symantec Leafminer July 2018),(Citation: Github PowerShell Empire),(Citation: IBM Grandoreiro April 2020),(Citation: Deply Mimikatz),(Citation: Directory Services Internals DPAPI Backup Keys Oct 2015),(Citation: Kaspersky Transparent Tribe August 2020),(Citation: DustySky),(Citation: Accenture Hogfish April 2018),(Citation: Cisco H1N1 Part 2),","['actor', 'process', 'data store', 'data flow']","[{'mitigation id': 'M1027', 'mitigation name': 'Password Policies', 'mitigation description': 'Set and enforce secure password policies for accounts.', 'mitigation url': 'https://attack.mitre.org/mitigations/M1027'}]"
T1555.005,Credentials from Password Stores: Password Managers,"Adversaries may acquire user credentials from third-party password managers.(Citation: ise Password Manager February 2019) Password managers are applications designed to store user credentials, normally in an encrypted database. Credentials are typically accessible after a user provides a master password that unlocks the database. After the database is unlocked, these credentials may be copied to memory. These databases can be stored as files on disk.(Citation: ise Password Manager February 2019)

Adversaries may acquire user credentials from password managers by extracting the master password and/or plain-text credentials from memory.(Citation: FoxIT Wocao December 2019)(Citation: Github KeeThief) Adversaries may extract credentials from memory via [Exploitation for Credential Access](https://attack.mitre.org/techniques/T1212).(Citation: NVD CVE-2019-3610)
 Adversaries may also try brute forcing via [Password Guessing](https://attack.mitre.org/techniques/T1110/001) to obtain the master password of a password manager.(Citation: Cyberreason Anchor December 2019)",https://attack.mitre.org/techniques/T1555/005,22 January 2021,25 March 2022,1.0,['Credential Access'],"Consider monitoring API calls, file read events, and processes for suspicious activity that could indicate searching in process memory of password managers. 

Consider monitoring file reads surrounding known password manager applications.","['Linux', 'Windows', 'macOS']","Command: Command Execution, File: File Access, Process: OS API Execution, Process: Process Access",True,T1555,,"Matt Burrough, @mattburrough, Microsoft",['User'],,,,,"(Citation: Kaspersky Ferocious Kitten Jun 2021),(Citation: FoxIT Wocao December 2019),(Citation: Trend Micro DRBControl February 2020),(Citation: CISA AA20-259A Iran-Based Actor September 2020),(Citation: Cyberreason Anchor December 2019),(Citation: objsee mac malware 2017),(Citation: NIST 800-63-3)","['actor', 'process', 'data store', 'data flow']","[{'mitigation id': 'M1027', 'mitigation name': 'Password Policies', 'mitigation description': 'Set and enforce secure password policies for accounts.', 'mitigation url': 'https://attack.mitre.org/mitigations/M1027'}, {'mitigation id': 'M1051', 'mitigation name': 'Update Software', 'mitigation description': 'Perform regular software updates to mitigate exploitation risk.', 'mitigation url': 'https://attack.mitre.org/mitigations/M1051'}, {'mitigation id': 'M1054', 'mitigation name': 'Software Configuration', 'mitigation description': 'Implement configuration changes to software (other than the operating system) to mitigate security risks associated to how the software operates.', 'mitigation url': 'https://attack.mitre.org/mitigations/M1054'}]"
T1556,Modify Authentication Process,"Adversaries may modify authentication mechanisms and processes to access user credentials or enable otherwise unwarranted access to accounts. The authentication process is handled by mechanisms, such as the Local Security Authentication Server (LSASS) process and the Security Accounts Manager (SAM) on Windows, pluggable authentication modules (PAM) on Unix-based systems, and authorization plugins on MacOS systems, responsible for gathering, storing, and validating credentials. By modifying an authentication process, an adversary may be able to authenticate to a service or system without using [Valid Accounts](https://attack.mitre.org/techniques/T1078).

Adversaries may maliciously modify a part of this process to either reveal credentials or bypass authentication mechanisms. Compromised credentials or access may be used to bypass access controls placed on various resources on systems within the network and may even be used for persistent access to remote systems and externally available services, such as VPNs, Outlook Web Access and remote desktop.",https://attack.mitre.org/techniques/T1556,11 February 2020,11 April 2023,2.3,"['Credential Access', 'Defense Evasion', 'Persistence']","Monitor for new, unfamiliar DLL files written to a domain controller and/or local computer. Monitor for changes to Registry entries for password filters (ex: <code>HKEY_LOCAL_MACHINE\SYSTEM\CurrentControlSet\Control\Lsa\Notification Packages</code>) and correlate then investigate the DLL files these files reference. 

Password filters will also show up as an autorun and loaded DLL in lsass.exe.(Citation: Clymb3r Function Hook Passwords Sept 2013)

Monitor for calls to <code>OpenProcess</code> that can be used to manipulate lsass.exe running on a domain controller as well as for malicious modifications to functions exported from authentication-related system DLLs (such as cryptdll.dll and samsrv.dll).(Citation: Dell Skeleton) 

Monitor PAM configuration and module paths (ex: <code>/etc/pam.d/</code>) for changes. Use system-integrity tools such as AIDE and monitoring tools such as auditd to monitor PAM files.

Monitor for suspicious additions to the /Library/Security/SecurityAgentPlugins directory.(Citation: Xorrior Authorization Plugins)

Configure robust, consistent account activity audit policies across the enterprise and with externally accessible services. (Citation: TechNet Audit Policy) Look for suspicious account behavior across systems that share accounts, either user, admin, or service accounts. Examples: one account logged into multiple systems simultaneously; multiple accounts logged into the same machine simultaneously; accounts logged in at odd times or outside of business hours. Activity may be from interactive login sessions or process ownership from accounts being used to execute binaries on a remote system as a particular account. Correlate other security systems with login information (e.g., a user has an active login session but has not entered the building or does not have VPN access).

Monitor property changes in Group Policy that manage authentication mechanisms (i.e. [Group Policy Modification](https://attack.mitre.org/techniques/T1484/001)). The <code>Store passwords using reversible encryption</code> configuration should be set to Disabled. Additionally, monitor and/or block suspicious command/script execution of <code>-AllowReversiblePasswordEncryption $true</code>, <code>Set-ADUser</code> and <code>Set-ADAccountControl</code>. Finally, monitor Fine-Grained Password Policies and regularly audit user accounts and group settings.(Citation: dump_pwd_dcsync)
","['Azure AD', 'Google Workspace', 'IaaS', 'Linux', 'Network', 'Office 365', 'SaaS', 'Windows', 'macOS']","Active Directory: Active Directory Object Modification, Application Log: Application Log Content, File: File Creation, File: File Modification, Logon Session: Logon Session Creation, Module: Module Load, Process: OS API Execution, Process: Process Access, User Account: User Account Authentication, User Account: User Account Modification, Windows Registry: Windows Registry Key Creation, Windows Registry: Windows Registry Key Modification",False,,['Multi-Factor Authentication'],Chris Ross @xorrior,,,,,,"(Citation: ESET Ebury Feb 2014),(Citation: GitHub SILENTTRINITY Modules July 2019),(Citation: ESET ForSSHe December 2018),(Citation: TechNet Least Privilege),(Citation: Mandiant Azure AD Backdoors),(Citation: Microsoft Securing Privileged Access),(Citation: Microsoft LSA),(Citation: TechNet Credential Theft),(Citation: store_pwd_rev_enc),(Citation: MagicWeb),(Citation: EnableMPRNotifications)","['actor', 'process', 'data store', 'data flow']","[{'mitigation id': 'M1018', 'mitigation name': 'User Account Management', 'mitigation description': 'Manage the creation, modification, use, and permissions associated to user accounts.', 'mitigation url': 'https://attack.mitre.org/mitigations/M1018'}, {'mitigation id': 'M1022', 'mitigation name': 'Restrict File and Directory Permissions', 'mitigation description': 'Restrict access by setting directory and file permissions that are not specific to users or privileged accounts.', 'mitigation url': 'https://attack.mitre.org/mitigations/M1022'}, {'mitigation id': 'M1024', 'mitigation name': 'Restrict Registry Permissions', 'mitigation description': 'Restrict the ability to modify certain hives or keys in the Windows Registry.', 'mitigation url': 'https://attack.mitre.org/mitigations/M1024'}, {'mitigation id': 'M1025', 'mitigation name': 'Privileged Process Integrity', 'mitigation description': 'Protect processes with high privileges that can be used to interact with critical system components through use of protected process light, anti-process injection defenses, or other process integrity enforcement measures.', 'mitigation url': 'https://attack.mitre.org/mitigations/M1025'}, {'mitigation id': 'M1026', 'mitigation name': 'Privileged Account Management', 'mitigation description': 'Manage the creation, modification, use, and permissions associated to privileged accounts, including SYSTEM and root.', 'mitigation url': 'https://attack.mitre.org/mitigations/M1026'}, {'mitigation id': 'M1027', 'mitigation name': 'Password Policies', 'mitigation description': 'Set and enforce secure password policies for accounts.', 'mitigation url': 'https://attack.mitre.org/mitigations/M1027'}, {'mitigation id': 'M1028', 'mitigation name': 'Operating System Configuration', 'mitigation description': 'Make configuration changes related to the operating system or a common feature of the operating system that result in system hardening against techniques.', 'mitigation url': 'https://attack.mitre.org/mitigations/M1028'}, {'mitigation id': 'M1032', 'mitigation name': 'Multi-factor Authentication', 'mitigation description': 'Use two or more pieces of evidence to authenticate to a system; such as username and password in addition to a token from a physical smart card or token generator.', 'mitigation url': 'https://attack.mitre.org/mitigations/M1032'}, {'mitigation id': 'M1047', 'mitigation name': 'Audit', 'mitigation description': 'Perform audits or scans of systems, permissions, insecure software, insecure configurations, etc. to identify potential weaknesses.', 'mitigation url': 'https://attack.mitre.org/mitigations/M1047'}]"
T1556.003,Modify Authentication Process: Pluggable Authentication Modules,"Adversaries may modify pluggable authentication modules (PAM) to access user credentials or enable otherwise unwarranted access to accounts. PAM is a modular system of configuration files, libraries, and executable files which guide authentication for many services. The most common authentication module is <code>pam_unix.so</code>, which retrieves, sets, and verifies account authentication information in <code>/etc/passwd</code> and <code>/etc/shadow</code>.(Citation: Apple PAM)(Citation: Man Pam_Unix)(Citation: Red Hat PAM)

Adversaries may modify components of the PAM system to create backdoors. PAM components, such as <code>pam_unix.so</code>, can be patched to accept arbitrary adversary supplied values as legitimate credentials.(Citation: PAM Backdoor)

Malicious modifications to the PAM system may also be abused to steal credentials. Adversaries may infect PAM resources with code to harvest user credentials, since the values exchanged with PAM components may be plain-text since PAM does not store passwords.(Citation: PAM Creds)(Citation: Apple PAM)",https://attack.mitre.org/techniques/T1556/003,26 June 2020,17 October 2021,2.0,"['Credential Access', 'Defense Evasion', 'Persistence']","Monitor PAM configuration and module paths (ex: <code>/etc/pam.d/</code>) for changes. Use system-integrity tools such as AIDE and monitoring tools such as auditd to monitor PAM files.

Look for suspicious account behavior across systems that share accounts, either user, admin, or service accounts. Examples: one account logged into multiple systems simultaneously; multiple accounts logged into the same machine simultaneously; accounts logged in at odd times (ex: when the user is not present) or outside of business hours. Activity may be from interactive login sessions or process ownership from accounts being used to execute binaries on a remote system as a particular account. Correlate other security systems with login information (e.g., a user has an active login session but has not entered the building or does not have VPN access).","['Linux', 'macOS']","File: File Modification, Logon Session: Logon Session Creation",True,T1556,,"George Allen, VMware Carbon Black; Scott Knight, @sdotknight, VMware Carbon Black",['root'],,,,,"(Citation: ESET Ebury Oct 2017),(Citation: Trend Micro Skidmap),","['actor', 'process', 'data store', 'data flow']","[{'mitigation id': 'M1026', 'mitigation name': 'Privileged Account Management', 'mitigation description': 'Manage the creation, modification, use, and permissions associated to privileged accounts, including SYSTEM and root.', 'mitigation url': 'https://attack.mitre.org/mitigations/M1026'}, {'mitigation id': 'M1032', 'mitigation name': 'Multi-factor Authentication', 'mitigation description': 'Use two or more pieces of evidence to authenticate to a system; such as username and password in addition to a token from a physical smart card or token generator.', 'mitigation url': 'https://attack.mitre.org/mitigations/M1032'}]"
T1556.006,Modify Authentication Process: Multi-Factor Authentication,"Adversaries may disable or modify multi-factor authentication (MFA) mechanisms to enable persistent access to compromised accounts.

Once adversaries have gained access to a network by either compromising an account lacking MFA or by employing an MFA bypass method such as [Multi-Factor Authentication Request Generation](https://attack.mitre.org/techniques/T1621), adversaries may leverage their access to modify or completely disable MFA defenses. This can be accomplished by abusing legitimate features, such as excluding users from Azure AD Conditional Access Policies, registering a new yet vulnerable/adversary-controlled MFA method, or by manually patching MFA programs and configuration files to bypass expected functionality.(Citation: Mandiant APT42)(Citation: Azure AD Conditional Access Exclusions)

For example, modifying the Windows hosts file (`C:\windows\system32\drivers\etc\hosts`) to redirect MFA calls to localhost instead of an MFA server may cause the MFA process to fail. If a ""fail open"" policy is in place, any otherwise successful authentication attempt may be granted access without enforcing MFA. (Citation: Russians Exploit Default MFA Protocol - CISA March 2022) 

Depending on the scope, goals, and privileges of the adversary, MFA defenses may be disabled for individual accounts or for all accounts tied to a larger group, such as all domain accounts in a victim's network environment.(Citation: Russians Exploit Default MFA Protocol - CISA March 2022) ",https://attack.mitre.org/techniques/T1556/006,31 May 2022,09 February 2023,1.0,"['Credential Access', 'Defense Evasion', 'Persistence']",,"['Azure AD', 'Google Workspace', 'IaaS', 'Linux', 'Office 365', 'SaaS', 'Windows', 'macOS']","Active Directory: Active Directory Object Modification, Logon Session: Logon Session Creation, User Account: User Account Authentication, User Account: User Account Modification",True,T1556,['Multi-Factor Authentication'],"Liran Ravich, CardinalOps; Muhammad Moiz Arshad, @5T34L7H",,,,,,",","['actor', 'process', 'data store', 'data flow']","[{'mitigation id': 'M1018', 'mitigation name': 'User Account Management', 'mitigation description': 'Manage the creation, modification, use, and permissions associated to user accounts.', 'mitigation url': 'https://attack.mitre.org/mitigations/M1018'}, {'mitigation id': 'M1032', 'mitigation name': 'Multi-factor Authentication', 'mitigation description': 'Use two or more pieces of evidence to authenticate to a system; such as username and password in addition to a token from a physical smart card or token generator.', 'mitigation url': 'https://attack.mitre.org/mitigations/M1032'}, {'mitigation id': 'M1047', 'mitigation name': 'Audit', 'mitigation description': 'Perform audits or scans of systems, permissions, insecure software, insecure configurations, etc. to identify potential weaknesses.', 'mitigation url': 'https://attack.mitre.org/mitigations/M1047'}]"
